[
  {
    "event_id": "36cf93e6-1b46-4cf5-8dfb-80cff8aa4ab1",
    "camera_id": "CAM-001",
    "timestamp": "2026-08-28T19:11:30+00:00",
    "epoch_ms": 1787944290000,
    "license_plate": {
      "text": "KA04MH1001",
      "confidence": 0.95,
      "is_clean": true
    },
    "bounding_box": [
      0.2,
      0.3,
      0.4,
      0.5
    ],
    "vehicle_attributes": {
      "type": "SEDAN",
      "color": "BLACK",
      "color_confidence": 0.95
    },
    "speed_kmh": 60.0,
    "heading_degrees": 180.0,
    "reid_embeddings": [
      0.747809475852613,
      -0.17378767209003798,
      0.7923115706006862,
      0.2598357142639873,
      0.07657580776000472,
      -0.6010969203957834,
      0.2721704172343973,
      -0.4108137468938553,
      0.9318228815317056,
      0.4214867860952636,
      -0.6031743278864847,
      0.4617235855339923,
      -0.8531303668442742,
      0.648537083212338,
      -0.2088055932351145,
      -0.9185318222320782,
      0.8441187393759715,
      -0.6339963299927884,
      0.777260137836123,
      0.04780198290803117,
      0.7541213188293809,
      -0.025082618723901495,
      0.08085309462473877,
      0.27696672760187746,
      0.6105366747713648,
      -0.4562133689391832,
      -0.9161606508763975,
      -0.7338136507939474,
      0.961874679752039,
      0.0480300076370086,
      -0.3310602890145917,
      -0.8004019602636303,
      -0.6953159221422123,
      -0.09066029039473866,
      0.8511367596425099,
      0.6702713640534705,
      0.5311903364976198,
      0.1322424169092833,
      0.07905153309061452,
      -0.604993257565229,
      -0.9187556883777659,
      0.6053949911695151,
      0.45759565639011446,
      0.9715521021287066,
      0.8303505488282155,
      0.5850644608086939,
      -0.7499619191007267,
      -0.4662497034345352,
      0.7260823880892342,
      -0.9913952265527526,
      -0.3685039139890598,
      0.9855001045223295,
      0.9314948284593603,
      0.20724024501568672,
      -0.22068824836982426,
      -0.8658043852953281,
      -0.35555503314808345,
      0.16162139595130487,
      -0.8228292814981826,
      0.5446262824248833,
      0.43118224175572184,
      -0.3317384848686642,
      0.45068339332254514,
      -0.4513348897658134,
      0.6696821361224463,
      -0.017598478087568203,
      0.9088695359950347,
      0.06647432936783626,
      0.5042758360945321,
      -0.16467455960498545,
      0.5887447284579288,
      0.0364554230663392,
      -0.5872849105798701,
      0.17853175212209615,
      -0.4813211715729451,
      -0.061198453678228626,
      -0.7802556193183912,
      -0.5296551922882704,
      -0.9846466675048815,
      -0.9056894399702571,
      0.24617422935799516,
      0.7491960595287173,
      -0.8264609828824643,
      -0.1687209804264027,
      -0.7466330626905291,
      0.3702172860418629,
      -0.5648662953771895,
      0.7907230971800885,
      0.04922082241862724,
      0.23111032538731657,
      -0.4726300682348119,
      -0.31066163727015894,
      0.14453793510088153,
      0.2883408189544383,
      -0.1475104948575796,
      -0.2026947280799678,
      -0.8002706049672756,
      -0.3602193540214329,
      -0.6679242072341629,
      0.9527362366214138,
      0.29874115765382814,
      -0.06312365165930012,
      0.1518527751166845,
      0.7878204059685607,
      0.1262922308761245,
      0.360288513249575,
      0.26955104295953425,
      0.7147458161309148,
      0.49015626628857367,
      0.8912177683075897,
      -0.0946040095681302,
      0.018358895636738648,
      0.532258210670286,
      0.8024795928713793,
      -0.08964290439166778,
      0.021256239125232668,
      0.5620508952477359,
      0.4999209476216657,
      0.5287690285725666,
      0.0808001720076088,
      -0.4133173864085111,
      -0.2555559679651167,
      0.4711653991668454,
      0.20848468523700192,
      0.21028203884611152,
      -0.4280933882789335,
      0.2831308197930811,
      0.3307473401054679
    ]
  },
  {
    "event_id": "08056711-0438-4bdb-9e95-d8fe4c6f62e3",
    "camera_id": "CAM-002",
    "timestamp": "2026-08-28T19:12:15+00:00",
    "epoch_ms": 1787944335000,
    "license_plate": {
      "text": "KA04MH1O01",
      "confidence": 0.65,
      "is_clean": false
    },
    "bounding_box": [
      0.2,
      0.3,
      0.4,
      0.5
    ],
    "vehicle_attributes": {
      "type": "SEDAN",
      "color": "BLACK",
      "color_confidence": 0.95
    },
    "speed_kmh": 60.0,
    "heading_degrees": 180.0,
    "reid_embeddings": [
      -0.2303283855766276,
      0.7189012488005946,
      0.34950551643721295,
      -0.9673966722928111,
      0.4835634899573844,
      -0.9079501654705453,
      0.22023853724531994,
      -0.39254931321919617,
      0.313051506651578,
      -0.38343262177120674,
      -0.20355844063416328,
      -0.8062405733411695,
      0.5557500283229684,
      0.1390608824111632,
      -0.5917495939803841,
      0.6882705559447362,
      0.6182521266953653,
      0.5109984154551888,
      -0.8144670127100915,
      -0.4321471671609234,
      -0.7938382764810283,
      0.026134966600714238,
      -0.24593186516435428,
      -0.9575144172102785,
      -0.5577360030639367,
      0.0528615222727391,
      0.4082812861478169,
      -0.6857187773840121,
      0.17489568187589888,
      -0.7382638409681319,
      0.8785806914051126,
      0.34337713720976737,
      0.9932230167131233,
      -0.6121480876338947,
      -0.8575205274888464,
      -0.4859426700785121,
      -0.027989827238766196,
      -0.878451202227347,
      -0.5318806177811553,
      -0.4022955505322017,
      0.3189429574017575,
      -0.49371949369915047,
      0.5639390742186876,
      -0.20030252086334044,
      0.6581742596070628,
      0.004017611627504136,
      0.2782564261639515,
      0.8720353860904242,
      0.6689732645763928,
      -0.4843918582796438,
      -0.03715134682101451,
      -0.4720604096139669,
      0.8176293666461376,
      -0.9083045186986316,
      0.1453625728039576,
      -0.74394063463349,
      -0.8345560917163748,
      0.8355640189210927,
      0.3330701709597004,
      -0.6778081313603936,
      -0.8448489478707424,
      0.6511647170609205,
      0.465474486585584,
      -0.05604551152523851,
      0.618837004188783,
      -0.35560302159485513,
      -0.4048367599505953,
      0.5022022284653336,
      0.6243383556242021,
      0.1921966111262834,
      -0.30542086729643003,
      0.5587952353987209,
      -0.4702584123341482,
      -0.8976932146283092,
      -0.8286891856738852,
      -0.9844533490797749,
      -0.5581721527716725,
      0.3487082885340056,
      0.3930657102152364,
      -0.5350237371662516,
      0.7048069925972127,
      -0.303960775366084,
      -0.5914001060418588,
      -0.35424908707899005,
      0.48387468045816306,
      0.7263666486189293,
      0.9414212308079835,
      0.12729643899754906,
      0.8201082246203095,
      -0.6633473987131728,
      -0.8344178584711239,
      0.25505944194272256,
      -0.8464423385935826,
      0.35576464772783556,
      0.4397255929011368,
      0.6743514730708202,
      -0.8460004365989247,
      -0.11981924326237015,
      0.8269119883183333,
      0.8478868542973679,
      0.27280669889479436,
      -0.7271650057486665,
      0.9579175782298026,
      0.888964007804451,
      -0.39381311901402016,
      0.1782387312097573,
      -0.5405045484308755,
      -0.271119577283901,
      0.8019104786857605,
      0.12357505496731047,
      -0.7009961046543098,
      -0.8953762657671511,
      -0.049436650558443374,
      -0.9158865236924467,
      0.6156435939758103,
      -0.42510139540478176,
      0.26105775128050146,
      0.5536170693857148,
      -0.7437491887816969,
      -0.7234198802626095,
      0.42990717701372794,
      0.6452641942406945,
      -0.9821445324935902,
      -0.3825328513554238,
      -0.2856657087482186,
      0.8097543119664079,
      -0.24989137793264304,
      0.8743426195740713
    ]
  }
]