[
  {
    "event_id": "8d4178eb-963e-45a3-a7b3-513f7ec7a499",
    "camera_id": "CAM-001",
    "timestamp": "2026-08-28T19:11:30+00:00",
    "epoch_ms": 1787944290000,
    "license_plate": {
      "text": "DL10CX5555",
      "confidence": 0.99,
      "is_clean": true
    },
    "bounding_box": [
      0.2,
      0.3,
      0.4,
      0.5
    ],
    "vehicle_attributes": {
      "type": "HATCHBACK",
      "color": "RED",
      "color_confidence": 0.95
    },
    "speed_kmh": 60.0,
    "heading_degrees": 180.0,
    "reid_embeddings": [
      0.9357242518081563,
      -0.645322364882158,
      -0.8580597381478716,
      0.7239857787820636,
      -0.6183155415627863,
      0.1994259134377976,
      -0.7169015883182164,
      -0.3590481436779176,
      0.6252244762427794,
      0.47810981002028674,
      -0.9485467691757119,
      0.09065152643562358,
      0.5555732892801162,
      -0.6787300473012496,
      -0.7706109757087376,
      0.37093973975991856,
      0.7833169661417159,
      -0.4390476526312299,
      0.669443940117386,
      0.48485546133526447,
      -0.41485046478833243,
      -0.6123897225637407,
      -0.31224251361701283,
      0.36290259658090496,
      0.12559182087556664,
      -0.4231450841396176,
      -0.7781715140526821,
      0.28743779516666845,
      -0.8126367496807727,
      0.7867093887725218,
      -0.10617558439425068,
      0.2486756780675612,
      0.8926926107667339,
      0.31636186759488294,
      -0.7694070558144115,
      0.9784594868964265,
      -0.3706493253290757,
      0.44178083552228875,
      -0.6910349636600666,
      0.44717510227960755,
      -0.9532111247874222,
      -0.27984353773885706,
      0.5189078679339472,
      0.018117856543468536,
      -0.3699086945215919,
      0.5612808580177371,
      0.8143093175989642,
      0.4573406626380665,
      -0.3850983343775414,
      0.7782530543044217,
      0.15606280121709926,
      -0.5538000789252147,
      -0.8016570121172426,
      -0.605124709730559,
      0.4508613605150702,
      -0.00430892633889135,
      0.3062295379185511,
      -0.7372729518145678,
      0.960060746983525,
      -0.1168875324786125,
      0.24704278468392715,
      0.9115371278846376,
      -0.10007876443924313,
      -0.17631169687712345,
      -0.7533404778141553,
      0.14117909701055598,
      -0.886781282936703,
      -0.4936143867792224,
      -0.9747720089012188,
      0.12364600473748322,
      -0.9548385917065989,
      0.19027085275349664,
      -0.6974410860546871,
      -0.2793342002625818,
      0.3895878674909392,
      -0.45788780470650114,
      0.7574399872926025,
      0.2922510818196695,
      -0.6710814967532093,
      0.19532413376775182,
      0.13419643161594164,
      -0.10394041796882214,
      -0.1932801201367127,
      0.3809933027181178,
      -0.8463537748064203,
      -0.3429098625596576,
      0.35534716851662473,
      -0.7858335156229763,
      -0.9173759559845667,
      0.8930623541861853,
      0.2160393315786624,
      -0.8465940864893713,
      -0.4917649163619815,
      -0.3031185286233584,
      0.5895930504276987,
      -0.3935274183511299,
      0.6069817237381654,
      -0.22677394810397034,
      -0.826714125549237,
      0.7219082605370915,
      0.6454373457700595,
      -0.6136356045668918,
      0.5784650287409183,
      0.13389241003173158,
      0.3148654334983785,
      0.9045160304442168,
      0.25285043979765853,
      0.06359147433818002,
      -0.8012794653168902,
      0.4842402133673578,
      -0.5982393961672419,
      0.2143230660942499,
      0.9858815090751905,
      -0.03289576238854264,
      0.050971460290307746,
      -0.23812641217635977,
      0.8823339960323284,
      0.09043049854496621,
      -0.2077600707464089,
      0.9642407637461912,
      -0.7686099816444771,
      -0.5658136871888446,
      -0.19174822263156366,
      -0.1918182392235115,
      -0.035895669202999914,
      0.6264525626786586,
      -0.12947178166941997,
      0.09639215129401157
    ]
  },
  {
    "event_id": "271c4171-f99d-4cf8-abc2-42906560053d",
    "camera_id": "CAM-005",
    "timestamp": "2026-08-28T19:11:32+00:00",
    "epoch_ms": 1787944292000,
    "license_plate": {
      "text": "DL10CX5555",
      "confidence": 0.98,
      "is_clean": true
    },
    "bounding_box": [
      0.2,
      0.3,
      0.4,
      0.5
    ],
    "vehicle_attributes": {
      "type": "HATCHBACK",
      "color": "RED",
      "color_confidence": 0.95
    },
    "speed_kmh": 60.0,
    "heading_degrees": 180.0,
    "reid_embeddings": [
      0.5626650283089982,
      -0.14419910788891155,
      0.639959721835581,
      -0.5649845202999795,
      0.012914125813906274,
      0.47031550783662124,
      -0.1738140649351272,
      -0.11555229050278948,
      -0.5858745696154648,
      0.2687161830341642,
      0.5731603364214721,
      -0.439557247642242,
      0.26744996301779045,
      0.09386633429726099,
      0.14485041667299403,
      -0.23610991288314964,
      0.9557419711465813,
      -0.4483385507087636,
      -0.2267103101205734,
      0.2413003965741285,
      0.6621806581853467,
      0.29689368826805773,
      -0.09458031766498687,
      0.9171134810526829,
      -0.33786018553343133,
      -0.6220387676733512,
      0.9132306952893461,
      -0.6254637451762506,
      -0.8259848825902669,
      -0.2018756146840881,
      -0.05565459197719402,
      -0.5602103957834836,
      0.5128624616095057,
      -0.08536019108526949,
      -0.0635668089409196,
      0.2549645817999171,
      0.300175582395386,
      -0.732554730961438,
      -0.0663389458004171,
      -0.9084926194795329,
      0.914209417058917,
      0.21263944538811042,
      0.7200016872656492,
      0.7982481902176033,
      -0.09046687642856943,
      -0.6785853183972845,
      0.2895937162618891,
      -0.8738804997216236,
      0.5178772742818709,
      0.9608359928001464,
      -0.2687409297051955,
      0.0548797581997813,
      -0.9140074984855127,
      -0.22692023369799608,
      -0.7411931720816676,
      0.8391312891330778,
      -0.7832689753702387,
      0.2907368871625966,
      -0.7842055704958495,
      -0.055143912450334565,
      0.3342190812162167,
      -0.408368415274722,
      0.14823900036818727,
      0.44652546900058354,
      -0.9950847524323627,
      0.692482107140856,
      -0.137780035685918,
      -0.12832198673070572,
      -0.27766757488649874,
      -0.3379984772268443,
      0.6773354002747232,
      -0.7640313213712184,
      -0.9153350755761314,
      -0.9134029665177155,
      0.5587615991352655,
      -0.5021793854458427,
      -0.11515881941713357,
      -0.8933313064346746,
      -0.8716036756729337,
      0.8515702118162352,
      0.9143968485033309,
      -0.7509405558810596,
      0.6798706448516056,
      0.7796355561298234,
      -0.6522750108369462,
      0.6739152708897522,
      -0.18224605472294075,
      0.6703059589593237,
      -0.37565511466377677,
      -0.7302898492916787,
      -0.2901282299674508,
      0.18148279503531461,
      0.7250769742630916,
      0.20229036522859545,
      -0.19022473271757878,
      0.5667023645580203,
      -0.37226593247892237,
      -0.5346415807715639,
      0.07331444131786569,
      -0.12486220106521051,
      0.6251972526899474,
      -0.876601399190881,
      0.3475719247516089,
      0.4922145976813841,
      -0.4874043733158342,
      -0.5168612603804517,
      0.22428115418490724,
      -0.9330431804856094,
      -0.5904700509596403,
      -0.265504662967049,
      -0.8828364744505306,
      0.9519879021173139,
      0.6538163351772586,
      -0.5073409616622706,
      -0.624889561736897,
      -0.8013458534773539,
      -0.687881555182775,
      -0.1795690634098457,
      -0.3675526763838075,
      0.6957476866899805,
      -0.7264542146071473,
      -0.8861610812841318,
      0.9436221627070678,
      -0.36947826062344524,
      -0.6036832797672935,
      0.13168366631431128,
      0.9821674093454453,
      -0.4466215493384571
    ]
  }
]